<?xml version="1.0" encoding="windows-1252" standalone="yes"?>
<!DOCTYPE document [
  <!ELEMENT document   (languageid,fields,page*)>
  <!ELEMENT languageid (#PCDATA)>
  <!ELEMENT fields     (Bron,Datum,Pagina)>
  <!ELEMENT Bron (#PCDATA)>
  <!ELEMENT Datum (#PCDATA)>
  <!ELEMENT Pagina (#PCDATA)>
  <!ELEMENT page       (pagenumber,text?,image?)>
  <!ELEMENT pagenumber (#PCDATA)>
  <!ELEMENT text       (#PCDATA)>
  <!ELEMENT image      (#PCDATA)>
  <!ATTLIST image      timestamp CDATA #REQUIRED
                       size      CDATA #REQUIRED>
]>
<document>
<languageid>21</languageid>
<fields>
<Bron>De Groene Amsterdammer</Bron>
<Datum>19300614</Datum>
<Pagina>2A</Pagina>
</fields>
<page>
<pagenumber>1</pagenumber>
<text>
IHDiE
ONZE GEÏLLUSTREERDE PRIJSCOURANT
WORDT GAARNE OP AANVRAAG KOSTELOOS
TOEGEZONDEN
ALLE IND. COSTUUMS WORDEN VOLGENS 'T
JUISTE MODEL DOOR BEKWAME COUPEURS
OP EIGEN ATELIER VERVAARDIGD
WITTE COSTUUMS
vanaf

WOLLEN PALMBEACH
COSTUUMS vanaf . .

COMPLETE INDISCHE
UITRUSTINGEN vanaf
16.50

29.75

99.50
ONZE VERTEGENWOORDIGER IS MET COMPLETE
COLLECTIE ZONDER EENIGE VERPLICHTING
DOOR HET GEHEELE LAND TE ONTBIEDEN
HkDRF
MOBACO
Bouw Speeldoozca
Zeer leerrijk en onderhottdend Speelgoed

' N. V. BOSCH, HONIG 6 Co,

DOMSTRAAT 6 - UTRECHT
Te GRONINGEN verkrijgbaar bij:
B. Eek hof f, O. Boteringestraat 21
Joh. Emmelot, Stoeldraaierstraat 3
In INDlE verkrijgbaar bij:
Toko Onderling Belang, Soerabaya.
i KIPS s es. i
SCHIEDAM J
Plaatijzeren Reservoirs, Blusleidingen, £
Schei»ns-Tanks •
AUTOGENE '-uASSCHING l
wA/ect/?


N.V. GOEDEWAAGCN -ÖOUDA
Abonneert U op: «^&gt; ••' *• •• «•

De Groene Amsterdammer
l
HouUfin'llos 2% d

Sigaren , . J et

M«t bons voor fraaie
geschenken

HOUBAER ft C*.
1930


Hendrik Kruimel

Wijnhandelaar Amsterdam

Kenig opvolger van

Schimmelpenmnck er Kruimel
Kantoor: Keizersgracht 325

Telefoon 40647 .
AUG. UILKEMA
GROOTSTE

HORLOGE MAG,

Reis wekkers

H. i 2.50 tot !1. 35.
Reguliersbreestraat 39
Zoo juist verschenen :

Dr.F.A.F.C.WENT
Huogleeraar aan de
Rijks-universiteit te
Utrecht


LEERBOEK


DER ALGEMEENE


PLANTKUNDE

MET 274 AFBEELDINGEN

TWEEDEDRUK

PRIJS,GEB.F18,50

Deze tweede druk is op verschil

lende plaatsen omgewerkt en in
overeenstemming gebracht met
den tegenwoorcligen stand der we

tenschap. Bij elke paragraaf is op
verzoek van veel kanttn literatuur
vermeld, waarop de inhoml is
gebaseerdi
UITGAVE VAN

J.B.WOLTERS

GRONINGEN - DEN HAAG
Verzoeke bij opgave

van verhuizingen dui


delijk te vermelden

of deze fijdeBijk of

bSijvend zijn.
voor
KAM PEEREN
in g root e keuze
ywi-iCT
JL JcLf
Verder alles op gebied van
kampeeren in voorraad.
AMSTERDAM C., Pr. HENDJllKKADE 120
Tel. 41709-—40717. Uitvoerige prijseourapt gratis op aanvrage.
HandeLsaruKwerk- Periodieken -Catalogi



Drukkerij J: lantijn


Amsterdam


Reclamedrukwerk - Greloswaaroig Papier
De cacaodrank.

Wordt gedronken met melk of spuitwater.
N. v. D. Hogenbirk 8 Zoon's

IJZER- en STAALINDUSTRIE

HAARLEM
Fabriek: Spaarndammerweg (SCHOTEN), Tel. 1442

Constructiewerkplaatsen, Machinefabriek, Ijzeren
Gebouwen, Overkappingen, Bruggen,
Kolommen, Reservoirs, enz.
Speciale cfdcxllag Hekwerken en Draadaficheldingcn, Dinrw Vlechtwerken
WedERAHDER&amp;Za,
WIJN H ANDELAREN

Amsterdam, Arnhem,

c.^ 's~Gravenhage ™™

Hoofdkantoor: Binnenkant 25, Amsterdam
INTERC. TELEFOON 40389
Hofleveranciers
woren op aanvrage
gaarne toegezon

COND,Tj£K

</text>
<image timestamp="2002:09:21:18:37:07.00" size="234691">0000088Y.TIF</image>
</page>
</document>
